PR,URL,Title,Content type,Is rendered page,HTTP status code,Organic traffic,AI content level,AI content status,No. of content words,Meta description,H1,Depth,Is indexable page
20,https://firemaths.info/budget-calculator,Budget Calculator: Free Monthly Expense Tracker & Planner,text/html; charset=utf-8,false,200,0,Very high,Success,1284,Take control of your finances with our free interactive budget calculator. Track income and expenses to instantly see where your money goes.,Monthly Budget Calculator,0,true
20,https://firemaths.info/cd-calculator,CD Calculator: Compare Certificate of Deposit Returns,text/html; charset=utf-8,false,200,0,Very high,Success,1036,Find out exactly how much your money will grow in a Certificate of Deposit. Will a longer term or higher rate yield better returns? See the math.,CD Growth Calculator,0,true
20,https://firemaths.info/529-calculator,529 Growth Calculator | Project College Savings,text/html; charset=utf-8,false,200,0,High,Success,1528,Will your 529 plan actually cover future tuition? Our 529 growth calculator reveals the exact potential shortfall—or surplus—based on your contributions.,529 Growth Calculator,0,true
20,https://firemaths.info/credit-card-comparison,Credit Card Comparison Guide: Maximize Your Rewards,text/html; charset=utf-8,false,200,0,High,Success,1731,"Stop leaving free money on the table. Discover exactly how to compare credit cards, evaluate hidden perks, and choose the perfect card for your spending habits.",Credit Card Comparison Guide,0,true
20,https://firemaths.info/car-insurance-calculator,Car Insurance Calculator | Estimate Your Auto Insurance Costs,text/html; charset=utf-8,false,200,0,High,Success,1041,"Find out how much you should be paying for car insurance! Use our advanced calculator to get instant, customized rate estimates based on real-world...",Car Insurance Calculator,0,true
