PR,URL,Title,Content type,Is rendered page,HTTP status code,Organic traffic,Depth,No. of inlinks dofollow,No. of inlinks nofollow,No. of href inlinks
20,https://westmountfundamentals.com/pe-ratio-by-sector-2026,P/E Ratio by Sector: S&P 500 Valuations 2026,text/html; charset=utf-8,false,200,0,0,1,0,1
20,https://westmountfundamentals.com/dow-jones-vs-sp500,Dow Jones vs S&P 500: Key Differences and Comparison Tool,text/html; charset=utf-8,false,200,0,0,1,0,1
20,https://westmountfundamentals.com/cost-of-living-by-state-2026,Cost of Living by State 2026: Affordability Ranked,text/html; charset=utf-8,false,200,0,0,1,0,1
20,https://westmountfundamentals.com/what-is-a-stock-split,What is a Stock Split? A Complete Guide for Investors,text/html; charset=utf-8,false,200,0,0,1,0,1
20,https://westmountfundamentals.com/when-to-sell-stocks,When to Sell Stocks: A Complete Beginner's Guide,text/html; charset=utf-8,false,200,0,0,1,0,1
20,https://westmountfundamentals.com/ulty-dividend-calculator,ULTY Dividend Calculator & Income Projection,text/html; charset=utf-8,false,200,0,0,1,0,1
20,https://westmountfundamentals.com/bond-calculator,"Free Bond Calculator | Calculate Price, YTM & Duration",text/html; charset=utf-8,false,200,0,0,1,0,1
20,https://westmountfundamentals.com/broker-fees,Online Broker Fee Comparison 2026 — Westmount Research,text/html; charset=utf-8,false,200,0,0,1,0,1
20,https://westmountfundamentals.com/home-equity-calculator,Home Equity Calculator | Calculate Your Borrowing Power,text/html; charset=utf-8,false,200,0,0,1,0,1
20,https://westmountfundamentals.com/wealthsimple-vs-questrade-vs-ibkr-2026,Wealthsimple vs Questrade vs IBKR (2026 Comparison),text/html; charset=utf-8,false,200,0,0,1,0,1
20,https://westmountfundamentals.com/schb-etf-review-2026,SCHB ETF Review: Schwab US Broad Market (2026),text/html; charset=utf-8,false,200,0,0,1,0,1
20,https://westmountfundamentals.com/sector-pe-ratios,GICS Sector P/E Ratios 2026: Which Sectors Are Overvalued?,text/html; charset=utf-8,false,200,0,0,1,0,1
20,https://westmountfundamentals.com/msty-dividend-calculator,MSTY Dividend Calculator | Estimate Your YieldMax MSTR Income,text/html; charset=utf-8,false,200,0,0,1,0,1
20,https://westmountfundamentals.com/equity-risk-premium,Earnings Yield vs Bond Yield: Is the Stock Market Fairly ...,text/html; charset=utf-8,false,200,0,0,1,0,1
20,https://westmountfundamentals.com/list-best-all-in-one-etfs-canada-2026,Best All-in-One ETFs in Canada 2026,text/html; charset=utf-8,false,200,0,0,1,0,1
20,https://westmountfundamentals.com/sp500-top-10-holdings-weight-2026,S&P 500 Top 10 Stocks by Weight 2026,text/html; charset=utf-8,false,200,0,0,1,0,1
20,https://westmountfundamentals.com/ipo-performance,IPO Performance Tracker: First-Year Returns 2024-2026,text/html; charset=utf-8,false,200,0,0,1,0,1
20,https://westmountfundamentals.com/compare-dividend-etfs,"Compare Dividend ETFs: SCHD, VYM, JEPI & More",text/html; charset=utf-8,false,200,0,0,1,0,1
20,https://westmountfundamentals.com/guide-options-basics,Options Trading for Beginners: A Complete Guide,text/html; charset=utf-8,false,200,0,0,1,0,1
20,https://westmountfundamentals.com/guide-reading-financial-statements,How to Read Financial Statements - Westmount Fundamentals,text/html; charset=utf-8,false,200,0,0,1,0,1
20,https://westmountfundamentals.com/guide-portfolio-diversification,Portfolio Diversification Guide: How Many Stocks Do You A...,text/html; charset=utf-8,false,200,0,0,1,0,1
20,https://westmountfundamentals.com/what-is-short-selling,What is Short Selling? A Complete Guide to Shorting Stocks,text/html; charset=utf-8,false,200,0,0,1,0,1
20,https://westmountfundamentals.com/three-fund-portfolio,The Three-Fund Portfolio: The Ultimate Lazy Strategy,text/html; charset=utf-8,false,200,0,0,1,0,1
20,https://westmountfundamentals.com/what-is-limit-order,What is a Limit Order in Stocks? A Complete Guide for Investors,text/html; charset=utf-8,false,200,0,0,1,0,1
20,https://westmountfundamentals.com/margin-calculator-stocks,Margin Calculator: Stock Borrowing & Maintenance Needs,text/html; charset=utf-8,false,200,0,0,1,0,1
20,https://westmountfundamentals.com/average-institutional-ownership-2026,Average Institutional Ownership of US Public Companies,text/html; charset=utf-8,false,200,0,0,1,0,1
20,https://westmountfundamentals.com/stock-calculator,Stock Calculator: Project Your Investment Growth,text/html; charset=utf-8,false,200,0,0,1,0,1
20,https://westmountfundamentals.com/recession-indicator-dashboard-2026,Recession Indicators Dashboard 2026,text/html; charset=utf-8,false,200,0,0,1,0,1
20,https://westmountfundamentals.com/spy-vs-voo,SPY vs VOO: Which S&P 500 ETF is Better? | Westmount,text/html; charset=utf-8,false,200,0,0,1,0,1
20,https://westmountfundamentals.com/loan-calculator,Simple Loan Calculator | Real-time Monthly Payments,text/html; charset=utf-8,false,200,0,0,1,0,1
20,https://westmountfundamentals.com/topstep-dashboard,Topstep Dashboard Explained: Track Your Funded Trading,text/html; charset=utf-8,false,200,0,0,1,0,1
20,https://westmountfundamentals.com/debt-to-income-ratio-calculator,Debt-to-Income Ratio Calculator | Westmount,text/html; charset=utf-8,false,200,0,0,1,0,1
20,https://westmountfundamentals.com/gold-vs-stocks-historical,Gold vs Stocks: 50-Year Performance Comparison (1975-2026),text/html; charset=utf-8,false,200,0,0,1,0,1
20,https://westmountfundamentals.com/lowest-expense-ratio-etfs-2026,The Cheapest ETFs in 2026: Lowest Expense Ratio ETFs by C...,text/html; charset=utf-8,false,200,0,0,1,0,1
20,https://westmountfundamentals.com/market-concentration,S&P 500 Market Cap Concentration 2026 — Westmount Research,text/html; charset=utf-8,false,200,0,0,1,0,1
20,https://westmountfundamentals.com/etf-vs-mutual-fund,ETF vs Mutual Fund: Which is Right for You? (Complete Guide),text/html; charset=utf-8,false,200,0,0,1,0,1
20,https://westmountfundamentals.com/paper-trading-simulator,Free Paper Trading Simulator & Virtual Portfolio Manager,text/html; charset=utf-8,false,200,0,0,1,0,1
20,https://westmountfundamentals.com/schd-dividend-calculator,SCHD Dividend Calculator,text/html; charset=utf-8,false,200,0,0,1,0,1
20,https://westmountfundamentals.com/what-is-a-bond,What is a Bond? The Ultimate Guide for Beginners,text/html; charset=utf-8,false,200,0,0,1,0,1
20,https://westmountfundamentals.com/sp500-dividend-yield-history,S&P 500 Dividend Yield History: 1960–2026 Complete Data,text/html; charset=utf-8,false,200,0,0,1,0,1
20,https://westmountfundamentals.com/schd-vs-qqqi,SCHD vs QQQI: Dividend Growth vs High Options Income,text/html; charset=utf-8,false,200,0,0,1,0,1
20,https://westmountfundamentals.com/what-is-the-stock-market,What Is the Stock Market? A Beginner's Guide,text/html; charset=utf-8,false,200,0,0,1,0,1
20,https://westmountfundamentals.com/guide-technical-analysis-basics,Technical Analysis for Fundamental Investors: What Actually Works,text/html; charset=utf-8,false,200,0,0,1,0,1
20,https://westmountfundamentals.com/roe-rankings,Return on Equity Rankings: Most Efficient S&P 500 Compani...,text/html; charset=utf-8,false,200,0,0,1,0,1
20,https://westmountfundamentals.com/value-vs-growth-stocks-2026,Value vs Growth Stocks: Performance Comparison (2026),text/html; charset=utf-8,false,200,0,0,1,0,1
20,https://westmountfundamentals.com/sp500-historical-returns-by-year,S&P 500 Annual Returns by Year (1928-2026),text/html; charset=utf-8,false,200,0,0,1,0,1
20,https://westmountfundamentals.com/guide-tax-loss-harvesting,Tax Loss Harvesting Explained: Turn Losing Stocks Into Ta...,text/html; charset=utf-8,false,200,0,0,1,0,1
20,https://westmountfundamentals.com/best-stocks-to-buy,Best Stocks to Buy Now: Top Picks for 2025 and 2026,text/html; charset=utf-8,false,200,0,0,1,0,1
20,https://westmountfundamentals.com/stock-correlation-matrix,Stock Correlation Matrix | Westmount Fundamentals,text/html; charset=utf-8,false,200,0,0,1,0,1
20,https://westmountfundamentals.com/guide-rebalancing-strategies,Portfolio Rebalancing Strategy: When & How Often to Rebal...,text/html; charset=utf-8,false,200,0,0,1,0,1
20,https://westmountfundamentals.com/best-performing-stocks-2026,Best Performing Stocks 2026 YTD: Top Gainers in the S&P 500,text/html; charset=utf-8,false,200,0,0,1,0,1
20,https://westmountfundamentals.com/warren-buffett-portfolio-2026,Warren Buffett's Portfolio 2026: Every Berkshire Hathaway...,text/html; charset=utf-8,false,200,0,0,1,0,1
20,https://westmountfundamentals.com/bond-yield-curve-2026,Treasury Yield Curve 2026: Current Rates and Inversion An...,text/html; charset=utf-8,false,200,0,0,1,0,1
20,https://westmountfundamentals.com/guide-bond-ratings,Understanding Bond Ratings & Fixed Income,text/html; charset=utf-8,false,200,0,0,1,0,1
20,https://westmountfundamentals.com/how-to-pay-off-debt,How to Pay Off Debt Fast: Proven Strategies and The Math Behind Them,text/html; charset=utf-8,false,200,0,0,1,0,1
20,https://westmountfundamentals.com/bond-etf-expense-ratio-comparison,Bond ETF Expense Ratios Compared: BND vs IUSB vs AGG vs SCHZ,text/html; charset=utf-8,false,200,0,0,1,0,1
20,https://westmountfundamentals.com/nuclear-energy-stocks,Nuclear Energy Stocks: The Complete Investment Guide,text/html; charset=utf-8,false,200,0,0,1,0,1
20,https://westmountfundamentals.com/short-squeeze-candidates-march-2026,Short Squeeze Candidates March 2026: Stocks Most Likely t...,text/html; charset=utf-8,false,200,0,0,1,0,1
20,https://westmountfundamentals.com/what-is-liquidity,What is Liquidity in Stocks? A Guide to Market Liquidity,text/html; charset=utf-8,false,200,0,0,1,0,1
20,https://westmountfundamentals.com/list-highest-dividend-yield-stocks-2026,50 Highest Dividend Yield Stocks in S&P 500 (2026),text/html; charset=utf-8,false,200,0,0,1,0,1
20,https://westmountfundamentals.com/what-is-an-etf,What is an ETF? The Beginner's Guide to Exchange-Traded Funds,text/html; charset=utf-8,false,200,0,0,1,0,1
20,https://westmountfundamentals.com/list-best-target-date-funds-2026,Best Target Date Funds 2026,text/html; charset=utf-8,false,200,0,0,1,0,1
20,https://westmountfundamentals.com/ceo-compensation,CEO Compensation vs Stock Performance 2026,text/html; charset=utf-8,false,200,0,0,1,0,1
20,https://westmountfundamentals.com/what-is-a-hedge-fund,What Is a Hedge Fund? The Ultimate Guide,text/html; charset=utf-8,false,200,0,0,1,0,1
20,https://westmountfundamentals.com/vea-etf-review-2026,VEA ETF Review: Vanguard Developed Markets (2026),text/html; charset=utf-8,false,200,0,0,1,0,1
20,https://westmountfundamentals.com/stock-return-calculator,Stock Return Calculator: True Annualized Profit Simulator,text/html; charset=utf-8,false,200,0,0,1,0,1
20,https://westmountfundamentals.com/guide-tax-efficient-investing,Tax-Efficient Investing: Complete Strategy Guide,text/html; charset=utf-8,false,200,0,0,1,0,1
20,https://westmountfundamentals.com/what-is-market-capitalization,What Is Market Capitalization? A Complete Guide | Westmount Fundamentals,text/html; charset=utf-8,false,200,0,0,1,0,1
20,https://westmountfundamentals.com/what-is-roth-ira,What is a Roth IRA? The Complete Beginner's Guide,text/html; charset=utf-8,false,200,0,0,1,0,1
20,https://westmountfundamentals.com/sp500-sector-weights,S&P 500 Sector Weights: The 25-Year Rotation (2000-2026),text/html; charset=utf-8,false,200,0,0,1,0,1
20,https://westmountfundamentals.com/ai-stocks-to-watch-2026,AI Stocks to Watch 2026 - Westmount Fundamentals,text/html; charset=utf-8,false,200,0,0,1,0,1
20,https://westmountfundamentals.com/what-is-expense-ratio,What is an Expense Ratio? The Hidden Cost of Investing Explained,text/html; charset=utf-8,false,200,0,0,1,0,1
20,https://westmountfundamentals.com/buyback-leaders,Stock Buyback Leaders 2026: Who Is Repurchasing the Most ...,text/html; charset=utf-8,false,200,0,0,1,0,1
20,https://westmountfundamentals.com/roth-vs-traditional-ira,Roth IRA vs Traditional IRA: Which is Better For You?,text/html; charset=utf-8,false,200,0,0,1,0,1
20,https://westmountfundamentals.com/ev-ebitda-sectors,EV/EBITDA by Sector: Enterprise Value Multiples 2026,text/html; charset=utf-8,false,200,0,0,1,0,1
20,https://westmountfundamentals.com/how-to-invest-in-bonds,How to Invest in Bonds: A Complete Guide for Beginners to Advanced,text/html; charset=utf-8,false,200,0,0,1,0,1
20,https://westmountfundamentals.com/dividend-calculator,Dividend Calculator: Project Your Income and Reinvestment Returns,text/html; charset=utf-8,false,200,0,0,1,0,1
20,https://westmountfundamentals.com/fortune-500-vs-sp500,Fortune 500 vs S&P 500: What's the Difference?,text/html; charset=utf-8,false,200,0,0,1,0,1
20,https://westmountfundamentals.com/vgro-etf-review-2026,VGRO ETF Review 2026: 80/20 Portfolio Canada,text/html; charset=utf-8,false,200,0,0,1,0,1
20,https://westmountfundamentals.com/what-is-an-ira,What Is an IRA? A Complete Guide for Beginners,text/html; charset=utf-8,false,200,0,0,1,0,1
20,https://westmountfundamentals.com/how-to-build-wealth,How to Build Wealth: A Fundamental Guide to Financial Independence,text/html; charset=utf-8,false,200,0,0,1,0,1
20,https://westmountfundamentals.com/what-is-a-mutual-fund,What is a Mutual Fund? | The Complete Beginner's Guide,text/html; charset=utf-8,false,200,0,0,1,0,1
20,https://westmountfundamentals.com/small-cap-value-stocks-2026,Small Cap Value Stocks 2026: Undervalued Small Companies ...,text/html; charset=utf-8,false,200,0,0,1,0,1
20,https://westmountfundamentals.com/list-best-monthly-dividend-stocks,Best Monthly Dividend Stocks & ETFs (2026),text/html; charset=utf-8,false,200,0,0,1,0,1
20,https://westmountfundamentals.com/stocks-vs-bonds,Stocks vs Bonds: The Complete Guide for Modern Investors,text/html; charset=utf-8,false,200,0,0,1,0,1
20,https://westmountfundamentals.com/debt-to-equity,Debt-to-Equity Rankings: Most & Least Leveraged S&P 500 C...,text/html; charset=utf-8,false,200,0,0,1,0,1
20,https://westmountfundamentals.com/russell-3000-vs-sp500,Russell 3000 vs S&P 500: Total Market Comparison Tool,text/html; charset=utf-8,false,200,0,0,1,0,1
20,https://westmountfundamentals.com/guide-emergency-fund,Emergency Fund Guide: How Much to Save & Where,text/html; charset=utf-8,false,200,0,0,1,0,1
20,https://westmountfundamentals.com/inflation-adjusted-stock-returns,Inflation-Adjusted Stock Returns: Real S&P 500 Returns 19...,text/html; charset=utf-8,false,200,0,0,1,0,1
20,https://westmountfundamentals.com/splg-etf-review-2026,SPLG ETF Review: SPDR Portfolio S&P 500 (2026),text/html; charset=utf-8,false,200,0,0,1,0,1
20,https://westmountfundamentals.com/tfsa-contribution-room-2026,TFSA Contribution Room & Limits (2026 Calculator),text/html; charset=utf-8,false,200,0,0,1,0,1
20,https://westmountfundamentals.com/stock-splits-history,Stock Split History & Post-Split Performance (2020-2026),text/html; charset=utf-8,false,200,0,0,1,0,1
20,https://westmountfundamentals.com/day-trading-simulator,Day Trading Simulator: Test Your Strategy Risk-Free,text/html; charset=utf-8,false,200,0,0,1,0,1
20,https://westmountfundamentals.com/list-best-money-market-funds-2026,Best Money Market Funds 2026: Top Yields Ranked,text/html; charset=utf-8,false,200,0,0,1,0,1
20,https://westmountfundamentals.com/interest-calculator,Interest Calculator - Calculate Simple & Compound Interest,text/html; charset=utf-8,false,200,0,0,1,0,1
20,https://westmountfundamentals.com/sp500-returns-by-month,S&P 500 Returns by Month: Seasonal Market Patterns,text/html; charset=utf-8,false,200,0,0,1,0,1
20,https://westmountfundamentals.com/insider-trading,Insider Trading Tracker: Who Is Buying & Selling Their Ow...,text/html; charset=utf-8,false,200,0,0,1,0,1
20,https://westmountfundamentals.com/vcsh-etf-review-2026,VCSH ETF Review: Vanguard Short-Term Corp Bond,text/html; charset=utf-8,false,200,0,0,1,0,1
20,https://westmountfundamentals.com/how-to-invest-in-etfs,How to Invest in ETFs: A Complete Guide for Beginners & Beyond,text/html; charset=utf-8,false,200,0,0,1,0,1
20,https://westmountfundamentals.com/growth-vs-value-stocks,Growth vs Value Stocks: Which Investing Strategy Wins?,text/html; charset=utf-8,false,200,0,0,1,0,1
20,https://westmountfundamentals.com/retirement-withdrawal-calculator,Retirement Withdrawal Calculator: 4% Rule & Beyond,text/html; charset=utf-8,false,200,0,0,1,0,1
20,https://westmountfundamentals.com/savings-calculator,Savings Calculator: Model Compound Interest & Growth,text/html; charset=utf-8,false,200,0,0,1,0,1
20,https://westmountfundamentals.com/revenue-per-employee,Revenue Per Employee: The Most Efficient Companies in the...,text/html; charset=utf-8,false,200,0,0,1,0,1
20,https://westmountfundamentals.com/dave-ramsey-investment-calculator,Dave Ramsey Investment Calculator | Compound Interest Growth,text/html; charset=utf-8,false,200,0,0,1,0,1
20,https://westmountfundamentals.com/qqq-vs-sp500,QQQ vs S&P 500: Compare Index Funds & Performance,text/html; charset=utf-8,false,200,0,0,1,0,1
20,https://westmountfundamentals.com/most-shorted-stocks-march-2026,Most Shorted Stocks March 2026: Complete Short Interest R...,text/html; charset=utf-8,false,200,0,0,1,0,1
20,https://westmountfundamentals.com/wage-growth-vs-inflation-2026,Wage Growth vs Inflation Tracker 2026 | Real Income Data,text/html; charset=utf-8,false,200,0,0,1,0,1
20,https://westmountfundamentals.com/dividend-yield-vs-growth,Dividend Yield vs Growth Rate: S&P 500 Analysis 2026,text/html; charset=utf-8,false,200,0,0,1,0,1
20,https://westmountfundamentals.com/guide-index-fund-investing-beginners,Index Fund Investing for Beginners,text/html; charset=utf-8,false,200,0,0,1,0,1
20,https://westmountfundamentals.com/free-cash-flow-yield,Free Cash Flow Yield: Top 50 S&P 500 Companies 2026,text/html; charset=utf-8,false,200,0,0,1,0,1
20,https://westmountfundamentals.com/tax-loss-harvesting-calculator,Tax-Loss Harvesting Calculator & Strategy Guide,text/html; charset=utf-8,false,200,0,0,1,0,1
20,https://westmountfundamentals.com/real-return-calculator,Real Return Calculator: Inflation-Adjusted Returns,text/html; charset=utf-8,false,200,0,0,1,0,1
20,https://westmountfundamentals.com/sp500-earnings-growth-rankings,S&P 500 Earnings Growth Rankings 2026: Fastest Growing Co...,text/html; charset=utf-8,false,200,0,0,1,0,1
20,https://westmountfundamentals.com/what-is-a-401k,What is a 401k? The Complete Guide for Beginners,text/html; charset=utf-8,false,200,0,0,1,0,1
20,https://westmountfundamentals.com/nancy-pelosi-stock-tracker,Nancy Pelosi Stock Tracker: Congressional Copy-Trade Calculator,text/html; charset=utf-8,false,200,0,0,1,0,1
20,https://westmountfundamentals.com/qqqi-dividend-calculator,QQQI Dividend Income Calculator & Yield Projector,text/html; charset=utf-8,false,200,0,0,1,0,1
20,https://westmountfundamentals.com/price-to-book,Price-to-Book Ratio Rankings by Sector 2026,text/html; charset=utf-8,false,200,0,0,1,0,1
20,https://westmountfundamentals.com/etf-flows-tracker-2026,ETF Fund Flows Tracker: Inflows & Outflows (2026),text/html; charset=utf-8,false,200,0,0,1,0,1
20,https://westmountfundamentals.com/canadian-dividend-aristocrats-2026,Canadian Dividend Aristocrats Complete List (2026),text/html; charset=utf-8,false,200,0,0,1,0,1
20,https://westmountfundamentals.com/stock-market-returns-by-year,Stock Market Returns by Year: S&P 500 Annual Performance ...,text/html; charset=utf-8,false,200,0,0,1,0,1
20,https://westmountfundamentals.com/what-is-a-fiduciary,What is a Fiduciary? The Essential Guide to Financial Trust,text/html; charset=utf-8,false,200,0,0,1,0,1
20,https://westmountfundamentals.com/voo-vs-sp500,VOO vs S&P 500: What's the Real Difference?,text/html; charset=utf-8,false,200,0,0,1,0,1
20,https://westmountfundamentals.com/average-etf-expense-ratio-2026,Average ETF Expense Ratio (2026): What You Should Actuall...,text/html; charset=utf-8,false,200,0,0,1,0,1
20,https://westmountfundamentals.com/what-is-capital-gains-tax,What is Capital Gains Tax? A Complete Guide for Investors,text/html; charset=utf-8,false,200,0,0,1,0,1
20,https://westmountfundamentals.com/what-is-a-bull-market,"What is a Bull Market? Definition, Characteristics, and How to Invest",text/html; charset=utf-8,false,200,0,0,1,0,1
20,https://westmountfundamentals.com/what-is-money-market-account,What is a Money Market Account? Complete Guide,text/html; charset=utf-8,false,200,0,0,1,0,1
20,https://westmountfundamentals.com/high-yield-dividend-etfs,Top High-Yield Dividend ETFs for Passive Income,text/html; charset=utf-8,false,200,0,0,1,0,1
20,https://westmountfundamentals.com/xeqt-etf-review-2026,XEQT ETF Review 2026: iShares All Equity ETF vs VEQT,text/html; charset=utf-8,false,200,0,0,1,0,1
20,https://westmountfundamentals.com/sp500-sector-performance-study-2026,S&P 500 Sector Performance 2026 | Westmount Fundamentals,text/html; charset=utf-8,false,200,0,0,1,0,1
20,https://westmountfundamentals.com/what-is-compound-interest,What is Compound Interest? The Math Behind Wealth Building,text/html; charset=utf-8,false,200,0,0,1,0,1
20,https://westmountfundamentals.com/how-to-invest-in-international-etfs,How to Invest in International ETFs: A Beginner's Guide,text/html; charset=utf-8,false,200,0,0,1,0,1
20,https://westmountfundamentals.com/what-is-eps,What is EPS in Stocks? | Earnings Per Share Explained,text/html; charset=utf-8,false,200,0,0,1,0,1
20,https://westmountfundamentals.com/what-is-dollar-cost-averaging,What is Dollar Cost Averaging (DCA)? The Ultimate Guide,text/html; charset=utf-8,false,200,0,0,1,0,1
20,https://westmountfundamentals.com/what-is-dividend,What Is Dividend Yield? A Complete Overview,text/html; charset=utf-8,false,200,0,0,1,0,1
20,https://westmountfundamentals.com/institutional-ownership,Institutional Ownership: Most & Least Owned Stocks 2026,text/html; charset=utf-8,false,200,0,0,1,0,1
20,https://westmountfundamentals.com/largest-stock-buybacks-2026,Largest Stock Buybacks 2026: Which Companies Are Buying B...,text/html; charset=utf-8,false,200,0,0,1,0,1
20,https://westmountfundamentals.com/qqq-vs-qqqm,QQQ vs QQQM: Expense Ratio & Comparison Tool,text/html; charset=utf-8,false,200,0,0,1,0,1
20,https://westmountfundamentals.com/mutual-fund-calculator,Mutual Fund Calculator: Project Your Investment Growth,text/html; charset=utf-8,false,200,0,0,1,0,1
20,https://westmountfundamentals.com/what-is-bear-market,"What is a Bear Market? Definition, Causes, and How to Navigate It",text/html; charset=utf-8,false,200,0,0,1,0,1
20,https://westmountfundamentals.com/best-dividend-etfs-canada-2026,"Best Dividend ETFs in Canada 2026: XDV, VDY, CDZ Compared",text/html; charset=utf-8,false,200,0,0,1,0,1
20,https://westmountfundamentals.com/insider-buying-tracker-2026,S&P 500 Insider Buying Tracker (2026),text/html; charset=utf-8,false,200,0,0,1,0,1
20,https://westmountfundamentals.com/capital-gains-tax-calculator,Free Capital Gains Tax Calculator & Estimator (2024-2025 Rates),text/html; charset=utf-8,false,200,0,0,1,0,1
20,https://westmountfundamentals.com/debt-payoff-calculator,Debt Payoff Calculator: See Exactly When You'll Be Debt-Free,text/html; charset=utf-8,false,200,0,0,1,0,1
20,https://westmountfundamentals.com/fire-retirement-calculator,FIRE Retirement Calculator | Westmount Fundamentals,text/html; charset=utf-8,false,200,0,0,1,0,1
20,https://westmountfundamentals.com/portfolio-risk-calculator,Advanced Portfolio Risk Calculator | Westmount Research,text/html; charset=utf-8,false,200,0,0,1,0,1
20,https://westmountfundamentals.com/dividend-aristocrats-complete-list-2026,Complete List of S&P 500 Dividend Aristocrats,text/html; charset=utf-8,false,200,0,0,1,0,1
20,https://westmountfundamentals.com/list-best-robo-advisors-canada-2026,Best Robo-Advisors in Canada (2026) | Westmount Fundamentals,text/html; charset=utf-8,false,200,0,0,1,0,1
20,https://westmountfundamentals.com/sp500-peg-ratios,S&P 500 PEG Ratio Rankings 2026 - Westmount Fundamentals,text/html; charset=utf-8,false,200,0,0,1,0,1
20,https://westmountfundamentals.com/how-to-save-for-retirement,How to Save for Retirement: The Complete Guide,text/html; charset=utf-8,false,200,0,0,1,0,1
20,https://westmountfundamentals.com/how-do-stocks-work,How Do Stocks Work? A Beginner's Guide to the Market,text/html; charset=utf-8,false,200,0,0,1,0,1
20,https://westmountfundamentals.com/rrsp-contribution-limit-2026,RRSP Contribution Limit & Deduction Calculator 2026,text/html; charset=utf-8,false,200,0,0,1,0,1
20,https://westmountfundamentals.com/beta-volatility,Beta & Volatility Rankings: S&P 500 Risk Analysis (2026),text/html; charset=utf-8,false,200,0,0,1,0,1
20,https://westmountfundamentals.com/stock-correlation-matrix-2026,Stock Correlation Matrix 2026: What Actually Diversifies?,text/html; charset=utf-8,false,200,0,0,1,0,1
20,https://westmountfundamentals.com/operating-margin-by-industry-2026,Operating Margin by Industry: Profitability Rankings (2026),text/html; charset=utf-8,false,200,0,0,1,0,1
20,https://westmountfundamentals.com/what-is-a-portfolio-manager,What is a Portfolio Manager? The Complete Guide,text/html; charset=utf-8,false,200,0,0,1,0,1
20,https://westmountfundamentals.com/guide-roth-vs-traditional-ira,Roth vs Traditional IRA: Complete Decision Guide,text/html; charset=utf-8,false,200,0,0,1,0,1
20,https://westmountfundamentals.com/working-capital,Working Capital Efficiency Rankings 2026,text/html; charset=utf-8,false,200,0,0,1,0,1
20,https://westmountfundamentals.com/monte-carlo-portfolio-simulator,Monte Carlo Portfolio Simulator | Westmount Fundamentals,text/html; charset=utf-8,false,200,0,0,1,0,1
20,https://westmountfundamentals.com/market-concentration-analysis-2026,Stock Market Concentration Analysis 2026 | Westmount Fundamentals,text/html; charset=utf-8,false,200,0,0,1,0,1
20,https://westmountfundamentals.com/dollar-cost-averaging-calculator,Dollar Cost Averaging Calculator | Westmount Research,text/html; charset=utf-8,false,200,0,0,1,0,1
20,https://westmountfundamentals.com/stocks-to-invest-in,Stocks to Invest In: A Comprehensive Guide for 2025 and 2026,text/html; charset=utf-8,false,200,0,0,1,0,1
