PR,URL,Title,Content type,Is rendered page,HTTP status code,SERP title,No. of content words,Page text,Extracted text (raw <body>) (length),Text hash,Organic traffic,Is indexable page
20,https://westmountfundamentals.com/what-is-dividend-income,What is Dividend Income? A Complete Guide with Real Examples,text/html; charset=utf-8,false,200,,2452,<truncated>,15260,17739113944031090972,0,true
20,https://westmountfundamentals.com/dividend-definition,Dividend Definition: What It Is and How It Actually Works,text/html; charset=utf-8,false,200,,2834,<truncated>,18139,2867656827227483410,0,true
20,https://westmountfundamentals.com/options-vs-stocks,Options vs Stocks: The Honest Difference No One Tells You,text/html; charset=utf-8,false,200,,3053,<truncated>,18547,14484921628377258652,0,true
20,https://westmountfundamentals.com/what-is-a-dividend-stock,What Is a Dividend Stock? The Complete Beginner's Guide,text/html; charset=utf-8,false,200,,3493,<truncated>,22170,18233673636819087138,0,true
20,https://westmountfundamentals.com/investment-planner,Investment Planner & Calculator | Westmount Fundamentals,text/html; charset=utf-8,false,200,,2448,<truncated>,15145,17712756586610748506,0,true
20,https://westmountfundamentals.com/how-to-start-investing,How to Start Investing in Stocks: A Beginner's Guide,text/html; charset=utf-8,false,200,,2955,<truncated>,18296,4072135647018559559,0,true
20,https://westmountfundamentals.com/dividend-meaning,Dividend Meaning: How It Works & What You Need To Know,text/html; charset=utf-8,false,200,,3672,<truncated>,22906,31716918245471953,0,true
